{
  "schema_version": 1,
  "t246_case": "T246-C08",
  "recovery_classification": "malformed_unsupported",
  "fixture_path": "tests/fixtures/resumes/anonymous-malformed-resume.pdf",
  "fixture_sha256": "14bcd090baf31edba64e9cbd8cdfc15f943344aa72cb3675ad8e91bfcbce03ad",
  "recovery_input_sha256": "14bcd090baf31edba64e9cbd8cdfc15f943344aa72cb3675ad8e91bfcbce03ad",
  "failure_category": "malformed",
  "user_facing_recovery_category": "malformed_or_corrupted",
  "semantic_request_required": false,
  "credential_recovery_required": false,
  "maximum_semantic_backend_requests": 0,
  "maximum_live_broker_runs": 0,
  "automatic_retries": 0,
  "evidence_path": "spikes/codex-direct-oauth/evidence/codex-direct-oauth-t246-c08-a01-recovery.json",
  "expected_behavior": "The fixture is deliberately not a valid PDF. Deterministic extraction and validation fail closed with the malformed-document category before any semantic model invocation; no credential recovery is required; no draft or derived artifact is created; the user-facing recovery category is malformed_or_corrupted with a plain-language reason and manual-entry/retry recovery; only sanitized evidence is persisted and no raw parser exception or document content is stored.",
  "sanitized_evidence_contract": {
    "allowed_fields": [
      "evidence_classification",
      "t246_case",
      "fixture_path",
      "fixture_sha256",
      "recovery_input_sha256",
      "failure_category",
      "retryable",
      "user_facing_recovery_category",
      "semantic_request_attempted",
      "credential_recovery_attempted",
      "draft_created",
      "artifact_created",
      "raw_parser_exception_persisted",
      "raw_document_content_persisted",
      "validation_result_is_pass"
    ],
    "never_persist": [
      "raw parser exceptions",
      "document content",
      "credential material",
      "OAuth state",
      "provider payloads"
    ]
  }
}
